{
  "profile": {
    "name": "Marco Mbella",
    "email": "marcombella.pro@gmail.com",
    "location": {
      "fr": "Paris, Île-de-France",
      "en": "Paris, Île-de-France"
    },
    "eyebrow": {
      "fr": "Ingénieur logiciel · API & solutions FinTech",
      "en": "Software engineer · APIs & FinTech solutions"
    },
    "bio": {
      "fr": "Je suis Marco Mbella, ingénieur logiciel avec une expérience en conseil financier. Je relie les besoins métier, les intégrations API et la relation client. Mon objectif : accompagner les équipes commerciales et techniques dans les solutions FinTech.",
      "en": "I’m Marco Mbella, a software engineer with experience in financial advisory. I connect business needs, API integrations and client relationships. My goal is to support sales and engineering teams working on FinTech solutions."
    },
    "cvAsset": "assets/marco-mbella-cv-solutions-fintech.pdf"
  },
  "highlights": [
    {
      "id": "software",
      "icon": "code",
      "value": {
        "fr": "4 ans",
        "en": "4 years"
      },
      "description": {
        "fr": [
          "d’expérience",
          "en ingénierie logicielle"
        ],
        "en": [
          "of experience",
          "in software engineering"
        ]
      }
    },
    {
      "id": "finance",
      "icon": "cash",
      "value": {
        "fr": "2 ans",
        "en": "2 years"
      },
      "description": {
        "fr": [
          "de conseil",
          "financier"
        ],
        "en": [
          "of financial",
          "advisory experience"
        ]
      }
    },
    {
      "id": "studies",
      "icon": "graduation",
      "value": null,
      "description": {
        "fr": [
          "Études d’ingénierie logicielle",
          "3iL · 2021"
        ],
        "en": [
          "Software engineering studies",
          "3iL · 2021"
        ]
      }
    },
    {
      "id": "amf",
      "icon": "certificate",
      "value": null,
      "description": {
        "fr": [
          "Certification AMF",
          "ES Banque · 2025"
        ],
        "en": [
          "AMF certification",
          "ES Banque · 2025"
        ]
      }
    }
  ],
  "skills": [
    {
      "id": "backend",
      "eyebrow": "01 / BACKEND",
      "title": {
        "fr": "API & logique métier",
        "en": "APIs & business logic"
      },
      "description": {
        "fr": "Architectures modulaires, intégrations tierces, authentification et gestion des erreurs.",
        "en": "Modular architectures, third-party integrations, authentication and error handling."
      },
      "technologies": [
        "Node.js",
        "TypeScript",
        "NestJS",
        "Java",
        "Spring Boot",
        "Python",
        "FastAPI"
      ]
    },
    {
      "id": "frontend",
      "eyebrow": "02 / FRONTEND",
      "title": {
        "fr": "Interfaces & fullstack",
        "en": "Interfaces & fullstack"
      },
      "description": {
        "fr": "Des interfaces qui relient les besoins de l’utilisateur à la logique de l’application.",
        "en": "Interfaces that connect user needs with the application’s underlying logic."
      },
      "technologies": [
        "React",
        "Next.js",
        "Vue.js",
        "Angular",
        "TanStack Router"
      ]
    },
    {
      "id": "systems",
      "eyebrow": "03 / SYSTEMS",
      "title": {
        "fr": "Architecture & événements",
        "en": "Architecture & events"
      },
      "description": {
        "fr": "Services découplés, flux asynchrones, traitements idempotents et reprise sur erreur.",
        "en": "Decoupled services, asynchronous flows, idempotent processing and recovery."
      },
      "technologies": [
        "Clean Architecture",
        "RabbitMQ",
        "Kafka",
        "REST"
      ]
    },
    {
      "id": "devops",
      "eyebrow": "04 / DELIVERY",
      "title": {
        "fr": "DevOps & cloud",
        "en": "DevOps & cloud"
      },
      "description": {
        "fr": "Des déploiements reproductibles, automatisés et observables, du pipeline à l’infrastructure.",
        "en": "Reproducible, automated and observable deployments, from pipelines to infrastructure."
      },
      "technologies": [
        "Docker",
        "Kubernetes",
        "Terraform",
        "Ansible",
        "GitLab CI/CD",
        "GitHub Actions",
        "Azure · AWS · GCP"
      ]
    },
    {
      "id": "quality",
      "eyebrow": "05 / QUALITY",
      "title": {
        "fr": "Tests & qualité logicielle",
        "en": "Testing & software quality"
      },
      "description": {
        "fr": "La testabilité et la fiabilité comme points d’appui pour faire évoluer un système.",
        "en": "Testability and reliability as a foundation for evolving a system."
      },
      "technologies": [
        "TDD / BDD",
        "Jest",
        "Pytest",
        "Karma",
        "Cucumber",
        "SonarCloud",
        "Azure Test Plan"
      ]
    },
    {
      "id": "data",
      "eyebrow": "06 / DATA",
      "title": {
        "fr": "Données & persistance",
        "en": "Data & persistence"
      },
      "description": {
        "fr": "Structuration des données, requêtes, pagination et intégration avec la logique métier.",
        "en": "Data structures, queries, pagination and integration with business logic."
      },
      "technologies": [
        "SQL",
        "PostgreSQL",
        "Oracle",
        "MongoDB"
      ]
    }
  ],
  "experiences": [
    {
      "id": "smart-engine",
      "category": "finance",
      "current": true,
      "dates": {
        "fr": "Avr. 2025 — aujourd’hui",
        "en": "Apr. 2025 — present"
      },
      "location": "Paris, France",
      "company": "Smart Engine Advisory",
      "role": {
        "fr": "Finance & conseil digital",
        "en": "Finance & digital consulting"
      },
      "summary": {
        "fr": "Accompagnement de particuliers, analyse de situations financières et patrimoniales, et traduction de problématiques complexes en éléments utiles à la décision.",
        "en": "Supporting individuals, analyzing financial and wealth situations, and translating complex issues into useful information for decision-making."
      },
      "contributions": {
        "fr": [
          "Analyse des objectifs, de la situation et des contraintes du client.",
          "Travail sur les enjeux de financement, de crédit, d’endettement, d’investissement et de structuration patrimoniale.",
          "Analyse de données financières et vulgarisation auprès de différents interlocuteurs."
        ],
        "en": [
          "Analyzing clients’ goals, financial circumstances and constraints.",
          "Working on financing, credit, debt, investment and wealth structuring.",
          "Analyzing financial data and explaining complex topics to different stakeholders."
        ]
      },
      "technologies": [
        {
          "fr": "Analyse financière",
          "en": "Financial analysis"
        },
        {
          "fr": "Relation client",
          "en": "Client relationships"
        },
        {
          "fr": "Conseil digital",
          "en": "Digital consulting"
        }
      ]
    },
    {
      "id": "saegus",
      "category": "engineering",
      "current": false,
      "dates": {
        "fr": "Fév. — mars 2025",
        "en": "Feb. — Mar. 2025"
      },
      "location": "Paris, France",
      "company": "SAEGUS",
      "role": {
        "fr": "Backend Engineer · Freelance",
        "en": "Backend Engineer · Freelance"
      },
      "summary": {
        "fr": "Développement d’une application fullstack React / NestJS, avec une architecture modulaire, une authentification sécurisée et un déploiement reproductible.",
        "en": "Developed a React / NestJS fullstack application with a modular architecture, secure authentication and reproducible deployment."
      },
      "contributions": {
        "fr": [
          "Clean Architecture pour renforcer la testabilité et la maintenabilité.",
          "Authentification JWT et contrôle d’accès dynamique via CASL.",
          "Validation stricte des API et gestion centralisée des erreurs.",
          "Docker / Docker Compose, pagination, optimisation des requêtes et tests unitaires."
        ],
        "en": [
          "Clean Architecture to improve testability and maintainability.",
          "JWT authentication and dynamic access control through CASL.",
          "Strict API validation and centralized error handling.",
          "Docker / Docker Compose, pagination, query optimization and unit tests."
        ]
      },
      "technologies": [
        {
          "fr": "React",
          "en": "React"
        },
        {
          "fr": "NestJS",
          "en": "NestJS"
        },
        {
          "fr": "JWT · CASL",
          "en": "JWT · CASL"
        },
        {
          "fr": "Docker",
          "en": "Docker"
        }
      ]
    },
    {
      "id": "auchan",
      "category": "engineering",
      "current": false,
      "dates": {
        "fr": "Jan. — oct. 2024",
        "en": "Jan. — Oct. 2024"
      },
      "location": "Lille, France",
      "company": "Akkodis — Auchan",
      "role": {
        "fr": "Backend / Fullstack Engineer · DevOps",
        "en": "Backend / Fullstack Engineer · DevOps"
      },
      "summary": {
        "fr": "Industrialisation des processus de build, de test et de déploiement, avec un travail sur la reproductibilité des releases et la fiabilité opérationnelle.",
        "en": "Industrialized build, testing and deployment processes, with a focus on reproducible releases and operational reliability."
      },
      "contributions": {
        "fr": [
          "Pipelines CI/CD et automatisation sur plusieurs environnements.",
          "Conteneurisation Docker et orchestration Kubernetes.",
          "Observabilité, monitoring, gestion des incidents et analyse des causes racines.",